{
  "$schema": "https://schemas.unifold.org/devtools/portable-application-replay/1.0/schema.json",
  "protocolVersion": "1.0.0",
  "document": {
    "$schema": "https://schemas.unifold.org/ui-document/1.0/schema.json",
    "schemaVersion": "1.0.0",
    "id": "portable-profile-workflow",
    "revision": "revision-1",
    "catalog": { "name": "unifold-core", "version": "1.0.0" },
    "view": {
      "id": "profile",
      "type": "Button",
      "properties": { "label": "Save profile", "status": "idle" }
    }
  },
  "machines": [
    {
      "schemaVersion": "1.0.0",
      "id": "profile-workflow",
      "version": "1.0.0",
      "ownerId": "profile",
      "initial": "idle",
      "states": {
        "idle": {
          "on": {
            "org.unifold.ui.activation.v1": {
              "commands": ["mark-saved", "persist-profile"],
              "target": "saved"
            }
          }
        },
        "saved": {}
      }
    }
  ],
  "initialSnapshots": [
    {
      "id": "profile",
      "instanceId": "profile",
      "kind": "component",
      "type": "Button",
      "definitionVersion": "1.0.0",
      "scopePath": ["profile"],
      "revision": 0,
      "base": {
        "mounted": true,
        "visible": true,
        "interactive": true,
        "disabled": false,
        "ownDisabled": false,
        "readonly": false,
        "busy": false,
        "focused": false,
        "dataClassification": "public"
      },
      "attributes": {},
      "properties": { "label": "Save profile", "status": "idle" }
    }
  ],
  "controls": {
    "clock": [
      "2026-08-26T12:00:00.000Z",
      "2026-08-26T12:00:00.001Z",
      "2026-08-26T12:00:00.002Z",
      "2026-08-26T12:00:00.003Z",
      "2026-08-26T12:00:00.004Z",
      "2026-08-26T12:00:00.005Z",
      "2026-08-26T12:00:00.006Z",
      "2026-08-26T12:00:00.007Z",
      "2026-08-26T12:00:00.008Z",
      "2026-08-26T12:00:00.009Z"
    ],
    "randomness": [
      "transaction-1",
      "event-2",
      "event-3",
      "transaction-4",
      "event-5",
      "event-6",
      "event-7",
      "event-8",
      "dispose-transaction",
      "dispose-event"
    ]
  },
  "events": [
    {
      "specversion": "1.0",
      "id": "activation-1",
      "source": "urn:unifold:component:profile",
      "type": "org.unifold.ui.activation.v1",
      "time": "2026-08-26T11:59:59.999Z",
      "datacontenttype": "application/json",
      "correlationid": "profile-session",
      "transactionid": "input-transaction",
      "sequence": 41,
      "staterevision": 0,
      "data": {
        "phase": "intent",
        "runtime": { "documentId": "portable-profile-workflow" },
        "sourceNode": {
          "id": "profile",
          "instanceId": "profile",
          "kind": "component",
          "scopePath": ["profile"],
          "type": "Button",
          "version": "1.0.0"
        }
      }
    }
  ],
  "mockedEffects": [
    {
      "capability": "profile.save",
      "input": { "profileId": "profile-42" },
      "outcome": "completed",
      "receipt": { "provider": "fixture", "receiptId": "save-1" }
    }
  ],
  "expected": {
    "documentRevision": "revision-1",
    "runtimeRevision": 1,
    "runtimeStatus": "disposed",
    "machineVersions": { "profile-workflow": "1.0.0" },
    "machineStates": { "profile-workflow": "saved" },
    "snapshots": [
      {
        "id": "profile",
        "instanceId": "profile",
        "kind": "component",
        "type": "Button",
        "definitionVersion": "1.0.0",
        "scopePath": ["profile"],
        "revision": 1,
        "base": {
          "mounted": true,
          "visible": true,
          "interactive": true,
          "disabled": false,
          "ownDisabled": false,
          "readonly": false,
          "busy": false,
          "focused": false,
          "dataClassification": "public"
        },
        "attributes": {},
        "properties": { "label": "Save profile", "status": "saved" }
      }
    ],
    "events": [
      [
        "activation-1",
        "2026-08-26T11:59:59.999Z",
        "org.unifold.ui.activation.v1",
        1,
        0,
        "input-transaction",
        "",
        ""
      ],
      [
        "event-2",
        "2026-08-26T12:00:00.001Z",
        "org.unifold.ui.command.applied.v1",
        2,
        1,
        "transaction-1",
        "",
        ""
      ],
      [
        "event-3",
        "2026-08-26T12:00:00.002Z",
        "org.unifold.ui.command.applied.v1",
        3,
        1,
        "transaction-1",
        "event-3",
        ""
      ],
      [
        "transaction-4",
        "2026-08-26T12:00:00.003Z",
        "org.unifold.ui.transaction.committed.v1",
        4,
        1,
        "transaction-1",
        "",
        ""
      ],
      [
        "event-5",
        "2026-08-26T12:00:00.004Z",
        "org.unifold.ui.effect.requested.v1",
        5,
        1,
        "transaction-1",
        "event-3",
        "https://schemas.unifold.org/events/effect-data/1.0/schema.json"
      ],
      [
        "event-6",
        "2026-08-26T12:00:00.005Z",
        "org.unifold.ui.effect.completed.v1",
        6,
        1,
        "transaction-1",
        "event-3",
        "https://schemas.unifold.org/events/effect-data/1.0/schema.json"
      ],
      [
        "event-8",
        "2026-08-26T12:00:00.007Z",
        "org.unifold.ui.runtime.disposed.v1",
        7,
        1,
        "event-7",
        "",
        ""
      ]
    ],
    "effectReceipts": [
      {
        "capability": "profile.save",
        "effectId": "event-3",
        "outcome": "completed",
        "receipt": { "provider": "fixture", "receiptId": "save-1" }
      }
    ],
    "consumed": { "clock": 8, "events": 1, "mockedEffects": 1, "randomness": 8 }
  }
}
